{
  "$schema": "./schemas/manifest.schema.json",
  "version": 1,
  "defaults": {
    "viewport": {
      "width": 1440,
      "height": 1000,
      "deviceScaleFactor": 1
    },
    "locale": "en-US",
    "theme": "light",
    "sunstone": {
      "url": "${SUNSTONE_URL}",
      "username": "${SUNSTONE_USER}",
      "password": "${SUNSTONE_PASSWORD}"
    }
  },
  "environments": {
    "existing-sunstone": {
      "kind": "existing-sunstone",
      "notes": "Use SUNSTONE_URL, SUNSTONE_USER, and SUNSTONE_PASSWORD from the local shell."
    }
  },
  "screenshots": [
    {
      "id": "quickstart.sequence.login-page",
      "title": "Quickstart login page",
      "doc": "content/software/installation_process/frontend_installation/automated.md",
      "docLine": 126,
      "image": "assets/images/quickstart/light/sunstone_login_page.png",
      "darkImage": "assets/images/quickstart/dark/sunstone_login_page.png",
      "environment": "existing-sunstone",
      "recipe": "recipes/quickstart-minione.json",
      "capture": "login-page",
      "theme": "both",
      "tags": ["quickstart", "quickstart-sequence", "sunstone", "login"],
      "status": "draft",
      "notes": "First capture in the sequence. The next capture continues from this page state."
    },
    {
      "id": "quickstart.sequence.dashboard",
      "title": "Quickstart Sunstone dashboard",
      "doc": "content/software/installation_process/frontend_installation/automated.md",
      "docLine": 136,
      "image": "assets/images/quickstart/light/sunstone_dashboard.png",
      "darkImage": "assets/images/quickstart/dark/sunstone_dashboard.png",
      "environment": "existing-sunstone",
      "recipe": "recipes/quickstart-minione.json",
      "capture": "dashboard",
      "theme": "both",
      "tags": ["quickstart", "quickstart-sequence", "sunstone", "dashboard"],
      "status": "draft",
      "notes": "Second capture. It logs in using the browser state from the login-page capture."
    },
    {
      "id": "quickstart.sequence.select-vnetwork",
      "title": "Select Vnetwork",
      "doc": "content/software/installation_process/frontend_installation/automated.md",
      "docLine": 136,
      "image": "assets/images/quickstart/light/sunstone_select_vnetwork.png",
      "darkImage": "assets/images/quickstart/dark/sunstone_select_vnetwork.png",
      "environment": "existing-sunstone",
      "recipe": "recipes/quickstart-minione.json",
      "capture": "vnetwork-menu",
      "theme": "both",
      "tags": ["quickstart", "quickstart-sequence", "sunstone", "dashboard"],
      "status": "draft",
      "notes": "Select Vnetwork."
    },
    {
      "id": "quickstart.sequence.vnetwork-details",
      "title": "Quickstart vnetwork details",
      "doc": "content/software/installation_process/frontend_installation/automated.md",
      "docLine": 172,
      "image": "assets/images/quickstart/light/sunstone_network_details.png",
      "darkImage": "assets/images/quickstart/dark/sunstone_network_details.png",
      "environment": "existing-sunstone",
      "recipe": "recipes/quickstart-minione.json",
      "capture": "vnetwork-details",
      "theme": "both",
      "tags": ["quickstart", "quickstart-sequence", "sunstone", "navigation"],
      "status": "draft",
      "notes": "Third capture. It opens the Instances section before selecting VM Templates."
    },
    {
      "id": "quickstart.sequence.vm-template",
      "title": "Quickstart VM template",
      "doc": "content/software/installation_process/frontend_installation/automated.md",
      "docLine": 172,
      "image": "assets/images/quickstart/light/sunstone_vm_templates_alpine.png",
      "darkImage": "assets/images/quickstart/dark/sunstone_vm_templates_alpine.png",
      "environment": "existing-sunstone",
      "recipe": "recipes/quickstart-minione.json",
      "capture": "vm-template",
      "theme": "both",
      "tags": ["quickstart", "quickstart-sequence", "sunstone", "navigation"],
      "status": "draft",
      "notes": "Third capture. It opens the Instances section before selecting VM Templates."
    },
    {
      "id": "quickstart.sequence.vm-instantiate",
      "title": "Quickstart VM instantiate",
      "doc": "content/software/installation_process/frontend_installation/automated.md",
      "docLine": 172,
      "image": "assets/images/quickstart/light/sunstone_instantiate_vm_1.png",
      "darkImage": "assets/images/quickstart/dark/sunstone_instantiate_vm_1.png",
      "environment": "existing-sunstone",
      "recipe": "recipes/quickstart-minione.json",
      "capture": "vm-instantiate",
      "theme": "both",
      "tags": ["quickstart", "quickstart-sequence", "sunstone", "navigation"],
      "status": "draft",
      "notes": "Third capture. It opens the Instances section before selecting VM Templates."
    },
    {
      "id": "quickstart.sequence.vm-instantiate-2",
      "title": "Quickstart VM instantiate",
      "doc": "content/software/installation_process/frontend_installation/automated.md",
      "docLine": 172,
      "image": "assets/images/quickstart/light/sunstone_instantiate_vm_2.png",
      "darkImage": "assets/images/quickstart/dark/sunstone_instantiate_vm_2.png",
      "environment": "existing-sunstone",
      "recipe": "recipes/quickstart-minione.json",
      "capture": "vm-instantiate-2",
      "theme": "both",
      "tags": ["quickstart", "quickstart-sequence", "sunstone", "navigation"],
      "status": "draft",
      "notes": "Third capture. It opens the Instances section before selecting VM Templates."
    },
    {
      "id": "quickstart.sequence.vm-instances",
      "title": "Quickstart VM instances",
      "doc": "content/software/installation_process/frontend_installation/automated.md",
      "docLine": 172,
      "image": "assets/images/quickstart/light/sunstone_vm_instances.png",
      "darkImage": "assets/images/quickstart/dark/sunstone_vm_instances.png",
      "environment": "existing-sunstone",
      "recipe": "recipes/quickstart-minione.json",
      "capture": "vm-instances",
      "theme": "both",
      "tags": ["quickstart", "quickstart-sequence", "sunstone", "navigation"],
      "status": "draft",
      "notes": "Third capture. It opens the Instances section before selecting VM Templates."
    },
    {
      "id": "quickstart.sequence.vnc",
      "title": "Quickstart VNC",
      "doc": "content/software/installation_process/frontend_installation/automated.md",
      "docLine": 172,
      "image": "assets/images/quickstart/light/sunstone_vnc_alpine.png",
      "darkImage": "assets/images/quickstart/dark/sunstone_vnc_alpine.png",
      "environment": "existing-sunstone",
      "recipe": "recipes/quickstart-minione.json",
      "capture": "vnc",
      "theme": "both",
      "tags": ["quickstart", "quickstart-sequence", "sunstone", "navigation"],
      "status": "draft",
      "notes": "Third capture. It opens the Instances section before selecting VM Templates."
    }
  ]
}
